{
  "$schema": "http://json-schema.org/draft-07/schema#",
  "title": "Wisdom Entry",
  "type": "object",
  "properties": {
    "topic": {
      "type": "string"
    },
    "core_truth": {
      "type": "string"
    },
    "dimensions": {
      "type": "array",
      "items": {
        "type": "string"
      }
    },
    "life_application": {
      "type": "string"
    },
    "related_puzzle_ids": {
      "type": "array",
      "items": {
        "type": "string"
      }
    }
  },
  "required": ["topic", "core_truth", "dimensions", "life_application"]
}
