{
  "topic": "The Illusion of Control in Chaos",
  "core_truth": "Control is often a trauma response masquerading as strategy. True stability comes from internal grounding, not external micromanagement.",
  "dimensions": ["Power", "Surrender"],
  "life_application": "When facing unpredictable project changes, notice the urge to over-plan. Pause, feel the feet on the floor, and ask what specifically feels threatening.",
  "related_puzzle_ids": ["pz_042", "pz_105"]
}
